,Context,Response
111,"Client: I just feel like everything is gray and I don't have any motivation or energy. [SEP] Therapist: It sounds like you might be experiencing depression. Have you considered seeking professional help, like talking to a therapist or counselor? [SEP] Client: I haven't, but maybe that would help. [SEP] ",Therapist: It can be helpful to have someone to talk to and explore your thoughts and feelings in a safe and supportive environment. We can work together to develop some strategies for coping with your emotions and finding hope and meaning in your life.
112,"Therapist: It sounds like you might be experiencing depression. Have you considered seeking professional help, like talking to a therapist or counselor? [SEP] Client: I haven't, but maybe that would help. [SEP] Therapist: It can be helpful to have someone to talk to and explore your thoughts and feelings in a safe and supportive environment. We can work together to develop some strategies for coping with your emotions and finding hope and meaning in your life. [SEP] ",
113,"Client: I'm having trouble connecting with people. [SEP] Therapist: I'm sorry to hear that. Can you tell me more about what's been going on? [SEP] Client: It just feels like I don't have any close relationships. I have a lot of acquaintances, but no one I really connect with. [SEP] ",Therapist: That can be really tough to deal with. Have you tried joining any groups or clubs that align with your interests?
114,"Therapist: I'm sorry to hear that. Can you tell me more about what's been going on? [SEP] Client: It just feels like I don't have any close relationships. I have a lot of acquaintances, but no one I really connect with. [SEP] Therapist: That can be really tough to deal with. Have you tried joining any groups or clubs that align with your interests? [SEP] ","Client: I've thought about it, but I'm not sure where to start."
115,"Client: It just feels like I don't have any close relationships. I have a lot of acquaintances, but no one I really connect with. [SEP] Therapist: That can be really tough to deal with. Have you tried joining any groups or clubs that align with your interests? [SEP] Client: I've thought about it, but I'm not sure where to start. [SEP] ",Therapist: We can work together to explore some options for finding like-minded people and building deeper connections. It's important to have
116,Client: I feel like I'm stuck in my past and can't move on. [SEP] Therapist: That can be really challenging. Can you tell me more about what's been holding you back? [SEP] Client: I had a difficult childhood and I can't seem to shake off the memories and emotions. [SEP] ,Therapist: It's understandable to feel stuck in the past when you've experienced significant trauma. Would you be open to exploring some coping mechanisms that can help you move forward?
117,Therapist: That can be really challenging. Can you tell me more about what's been holding you back? [SEP] Client: I had a difficult childhood and I can't seem to shake off the memories and emotions. [SEP] Therapist: It's understandable to feel stuck in the past when you've experienced significant trauma. Would you be open to exploring some coping mechanisms that can help you move forward? [SEP] ,"Client: Yes, I would be open to that."
118,"Client: I had a difficult childhood and I can't seem to shake off the memories and emotions. [SEP] Therapist: It's understandable to feel stuck in the past when you've experienced significant trauma. Would you be open to exploring some coping mechanisms that can help you move forward? [SEP] Client: Yes, I would be open to that. [SEP] ","Therapist: Great. We can work together to develop some strategies, like mindfulness techniques and therapy, to help you heal and create a brighter future."
119,"lient: I feel like I'm always anxious about something. [SEP] Therapist: I'm sorry to hear that. Can you tell me more about what's been causing your anxiety? [SEP] Client: It feels like everything is a potential trigger for me. I worry about my health, my job, my relationships, and the future. [SEP] ",Therapist: It sounds like you're dealing with a lot of uncertainty and fear. Would you be open to exploring some cognitive-behavioral techniques to help you manage your anxiety and create more positive thinking patterns?
120,"Therapist: I'm sorry to hear that. Can you tell me more about what's been causing your anxiety? [SEP] Client: It feels like everything is a potential trigger for me. I worry about my health, my job, my relationships, and the future. [SEP] Therapist: It sounds like you're dealing with a lot of uncertainty and fear. Would you be open to exploring some cognitive-behavioral techniques to help you manage your anxiety and create more positive thinking patterns? [SEP] ","Client: Yes, that would be helpful."
121,"Client: It feels like everything is a potential trigger for me. I worry about my health, my job, my relationships, and the future. [SEP] Therapist: It sounds like you're dealing with a lot of uncertainty and fear. Would you be open to exploring some cognitive-behavioral techniques to help you manage your anxiety and create more positive thinking patterns? [SEP] Client: Yes, that would be helpful. [SEP] ","Therapist: Great. We can work together to develop some techniques, like reframing negative thoughts and practicing relaxation techniques, to help you manage your anxiety more effectively."
122,"Client: I feel like I'm always tired and can't seem to focus on anything. [SEP] Therapist: That sounds challenging. Can you tell me more about what's been going on? [SEP] Client: It feels like I'm constantly running on empty, and I can't seem to get motivated or excited about anything. [SEP] ",Therapist: It sounds like you might be experiencing burnout. Have you considered taking a break or exploring some stress-management techniques?
123,"Therapist: That sounds challenging. Can you tell me more about what's been going on? [SEP] Client: It feels like I'm constantly running on empty, and I can't seem to get motivated or excited about anything. [SEP] Therapist: It sounds like you might be experiencing burnout. Have you considered taking a break or exploring some stress-management techniques? [SEP] ","Client: I've thought about it, but I'm not sure where to start."
124,"Client: It feels like I'm constantly running on empty, and I can't seem to get motivated or excited about anything. [SEP] Therapist: It sounds like you might be experiencing burnout. Have you considered taking a break or exploring some stress-management techniques? [SEP] Client: I've thought about it, but I'm not sure where to start. [SEP] ","Therapist: We can work together to identify some strategies for self-care, like practicing mindfulness or taking a vacation, to help you recharge and find more balance in your life."
125,"Therapist: It sounds like you might be experiencing burnout. Have you considered taking a break or exploring some stress-management techniques? [SEP] Client: I've thought about it, but I'm not sure where to start. [SEP] Therapist: We can work together to identify some strategies for self-care, like practicing mindfulness or taking a vacation, to help you recharge and find more balance in your life. [SEP] ",
126,Client: I'm feeling really angry about something and I can't seem to shake it off. [SEP] Therapist: I'm sorry to hear that. Can you tell me more about what's been causing your anger? [SEP] Client: It's a situation at work where I feel like I've been treated unfairly. [SEP] ,Therapist: It's understandable to feel angry when you feel like you've been mistreated. Have you considered having a conversation with the person involved or exploring some anger-management techniques?
127,Therapist: I'm sorry to hear that. Can you tell me more about what's been causing your anger? [SEP] Client: It's a situation at work where I feel like I've been treated unfairly. [SEP] Therapist: It's understandable to feel angry when you feel like you've been mistreated. Have you considered having a conversation with the person involved or exploring some anger-management techniques? [SEP] ,"Client: I've thought about confronting them, but I don't want to cause any drama."
128,"Client: It's a situation at work where I feel like I've been treated unfairly. [SEP] Therapist: It's understandable to feel angry when you feel like you've been mistreated. Have you considered having a conversation with the person involved or exploring some anger-management techniques? [SEP] Client: I've thought about confronting them, but I don't want to cause any drama. [SEP] ","Therapist: We can work together to identify some healthy ways to manage your anger, like journaling or practicing assertiveness, so that you can express your feelings in a constructive way."
129,"Client: I'm feeling really lost in my career and I don't know what to do. [SEP] Therapist: That can be really tough. Can you tell me more about what you're struggling with? [SEP] Client: It feels like I've been stuck in the same job for years, and I don't feel fulfilled or challenged anymore. [SEP] ",Therapist: It's normal to feel stagnant in your career at times. Have you considered exploring some career options or working with a career counselor?
130,"Therapist: That can be really tough. Can you tell me more about what you're struggling with? [SEP] Client: It feels like I've been stuck in the same job for years, and I don't feel fulfilled or challenged anymore. [SEP] Therapist: It's normal to feel stagnant in your career at times. Have you considered exploring some career options or working with a career counselor? [SEP] ","Client: I've thought about it, but I'm not sure where to start."
131,"Client: It feels like I've been stuck in the same job for years, and I don't feel fulfilled or challenged anymore. [SEP] Therapist: It's normal to feel stagnant in your career at times. Have you considered exploring some career options or working with a career counselor? [SEP] Client: I've thought about it, but I'm not sure where to start. [SEP] ","Therapist: We can work together to identify some strategies for finding a career that aligns with your values and interests. It's important to feel fulfilled and challenged in your work, and we can explore some options to
"
132,"Client: I feel like I'm constantly failing at everything. [SEP] Therapist: I'm sorry to hear that. Can you tell me more about what's been going on? [SEP] Client: It feels like I can't do anything right, whether it's at work or in my personal life. [SEP] ",Therapist: It's understandable to feel that way when things aren't going well. Have you considered exploring some self-compassion techniques or working with a therapist to address any underlying issues?
133,"Therapist: I'm sorry to hear that. Can you tell me more about what's been going on? [SEP] Client: It feels like I can't do anything right, whether it's at work or in my personal life. [SEP] Therapist: It's understandable to feel that way when things aren't going well. Have you considered exploring some self-compassion techniques or working with a therapist to address any underlying issues? [SEP] ","Client: I've thought about it, but I'm not sure if it would help."
134,"Client: It feels like I can't do anything right, whether it's at work or in my personal life. [SEP] Therapist: It's understandable to feel that way when things aren't going well. Have you considered exploring some self-compassion techniques or working with a therapist to address any underlying issues? [SEP] Client: I've thought about it, but I'm not sure if it would help. [SEP] ","Therapist: We can work together to develop some strategies to help you build your confidence and overcome your self-doubt. It's important to be kind to yourself and focus on your strengths, even when things feel tough."
135,"Client: I'm feeling really alone and isolated. [SEP] Therapist: That sounds really difficult. Can you tell me more about what's been going on? [SEP] Client: It feels like I don't have any close friends or family members to turn to, and I'm struggling to connect with others. [SEP] ","Therapist: It's normal to feel lonely at times, but it's important to reach out for support when you need it. Have you considered exploring some social activities or support groups to help you connect with others?"
136,"Therapist: That sounds really difficult. Can you tell me more about what's been going on? [SEP] Client: It feels like I don't have any close friends or family members to turn to, and I'm struggling to connect with others. [SEP] Therapist: It's normal to feel lonely at times, but it's important to reach out for support when you need it. Have you considered exploring some social activities or support groups to help you connect with others? [SEP] ","Client: I've thought about it, but I'm not sure if it would help."
137,"Client: It feels like I don't have any close friends or family members to turn to, and I'm struggling to connect with others. [SEP] Therapist: It's normal to feel lonely at times, but it's important to reach out for support when you need it. Have you considered exploring some social activities or support groups to help you connect with others? [SEP] Client: I've thought about it, but I'm not sure if it would help. [SEP] ",Therapist: We can work together to identify some strategies to help you build social connections and overcome your feelings of isolation. It's important to have a support system in place to help you navigate life's challenges.
138,"Client: I'm feeling really guilty about something I did in the past. [SEP] Therapist: I'm sorry to hear that. Can you tell me more about what's been weighing on you? [SEP] Client: It's something I said to a friend that I regret, and I can't seem to forgive myself. [SEP] ","Therapist: It's understandable to feel guilty when you've hurt someone, but it's important to forgive yourself and move forward. Have you considered reaching out to your friend to apologize or exploring some forgiveness techniques to help you"
139,Client: I'm feeling really angry and frustrated. [SEP] Therapist: I hear you. Can you tell me more about what's been triggering these feelings? [SEP] Client: It's a co-worker who has been constantly undermining me and taking credit for my work. [SEP] ,"Therapist: It's understandable to feel angry when you're being treated unfairly, but it's important to address the situation in a constructive way. Have you considered talking to your co-worker about your concerns or exploring some assertiveness techniques to help you stand up for yourself?"
140,"Therapist: I hear you. Can you tell me more about what's been triggering these feelings? [SEP] Client: It's a co-worker who has been constantly undermining me and taking credit for my work. [SEP] Therapist: It's understandable to feel angry when you're being treated unfairly, but it's important to address the situation in a constructive way. Have you considered talking to your co-worker about your concerns or exploring some assertiveness techniques to help you stand up for yourself? [SEP] ","Client: I've thought about it, but I don't want to cause any drama."
141,"Client: It's a co-worker who has been constantly undermining me and taking credit for my work. [SEP] Therapist: It's understandable to feel angry when you're being treated unfairly, but it's important to address the situation in a constructive way. Have you considered talking to your co-worker about your concerns or exploring some assertiveness techniques to help you stand up for yourself? [SEP] Client: I've thought about it, but I don't want to cause any drama. [SEP] ",Therapist: We can work together to identify some strategies to help you navigate this difficult situation and find a way to assert your boundaries without causing conflict. It's important to prioritize your well-being and advocate for yourself in a respectful way.
142,"Therapist: It's understandable to feel angry when you're being treated unfairly, but it's important to address the situation in a constructive way. Have you considered talking to your co-worker about your concerns or exploring some assertiveness techniques to help you stand up for yourself? [SEP] Client: I've thought about it, but I don't want to cause any drama. [SEP] Therapist: We can work together to identify some strategies to help you navigate this difficult situation and find a way to assert your boundaries without causing conflict. It's important to prioritize your well-being and advocate for yourself in a respectful way. [SEP] ",
143,"Client: I'm feeling really overwhelmed by all of the responsibilities I have. [SEP] Therapist: I'm sorry to hear that. Can you tell me more about what's been causing your stress? [SEP] Client: It feels like there's never enough time in the day to get everything done, and I'm constantly juggling multiple priorities. [SEP] ",Therapist: It sounds like you might be experiencing some pressure to perform. Have you considered exploring some time-management techniques or working with a coach to help you prioritize your tasks?
144,"Therapist: I'm sorry to hear that. Can you tell me more about what's been causing your stress? [SEP] Client: It feels like there's never enough time in the day to get everything done, and I'm constantly juggling multiple priorities. [SEP] Therapist: It sounds like you might be experiencing some pressure to perform. Have you considered exploring some time-management techniques or working with a coach to help you prioritize your tasks? [SEP] ","Client: I've thought about it, but I don't know if it would make a difference."
145,"Client: It feels like there's never enough time in the day to get everything done, and I'm constantly juggling multiple priorities. [SEP] Therapist: It sounds like you might be experiencing some pressure to perform. Have you considered exploring some time-management techniques or working with a coach to help you prioritize your tasks? [SEP] Client: I've thought about it, but I don't know if it would make a difference. [SEP] ",Therapist: We can work together to identify some strategies to help you manage your workload and create more balance in your life. It's important to prioritize self-care and make time for the things that matter most to you.
146,Client: I'm feeling really lonely and disconnected. [SEP] Therapist: I hear you. Can you tell me more about what's been causing your feelings of loneliness? [SEP] Client: It feels like I don't have any close relationships or a sense of belonging. [SEP] ,"Therapist: It can be tough to feel isolated, but there are ways to connect with others and build meaningful relationships. Have you considered exploring some social activities or joining a group where you can meet like-minded individuals?"
147,"Therapist: I hear you. Can you tell me more about what's been causing your feelings of loneliness? [SEP] Client: It feels like I don't have any close relationships or a sense of belonging. [SEP] Therapist: It can be tough to feel isolated, but there are ways to connect with others and build meaningful relationships. Have you considered exploring some social activities or joining a group where you can meet like-minded individuals? [SEP] ","Client: I've thought about it, but I'm not sure if I'll fit in."
148,"Client: It feels like I don't have any close relationships or a sense of belonging. [SEP] Therapist: It can be tough to feel isolated, but there are ways to connect with others and build meaningful relationships. Have you considered exploring some social activities or joining a group where you can meet like-minded individuals? [SEP] Client: I've thought about it, but I'm not sure if I'll fit in. [SEP] ",Therapist: We can work together to identify some ways to help you build your social support network and overcome any feelings of self-doubt or insecurity. It's important to prioritize your social needs and find ways to connect with others who share your interests.
149,"Client: I'm feeling really stuck in my relationship. [SEP] Therapist: I hear you. Can you tell me more about what's been causing your feelings of stagnation? [SEP] Client: It feels like we're in a rut and things are becoming stagnant, and I'm not sure how to reignite the spark. [SEP] ","Therapist: It's normal to experience ups and downs in relationships, but there are ways to work through any challenges and strengthen your connection. Have you considered exploring some couples counseling or trying some new activities or experiences together to help reignite the spark?"
150,"Therapist: I hear you. Can you tell me more about what's been causing your feelings of stagnation? [SEP] Client: It feels like we're in a rut and things are becoming stagnant, and I'm not sure how to reignite the spark. [SEP] Therapist: It's normal to experience ups and downs in relationships, but there are ways to work through any challenges and strengthen your connection. Have you considered exploring some couples counseling or trying some new activities or experiences together to help reignite the spark? [SEP] ","Client: I've thought about it, but I'm not sure if it will make a difference."
151,"Client: It feels like we're in a rut and things are becoming stagnant, and I'm not sure how to reignite the spark. [SEP] Therapist: It's normal to experience ups and downs in relationships, but there are ways to work through any challenges and strengthen your connection. Have you considered exploring some couples counseling or trying some new activities or experiences together to help reignite the spark? [SEP] Client: I've thought about it, but I'm not sure if it will make a difference. [SEP] ",Therapist: We can work together to identify some strategies to help you and your partner communicate more effectively and find ways to deepen your connection. It's important to prioritize your relationship and find ways to strengthen your bond.
152,Client: I'm feeling really insecure and self-conscious. [SEP] Therapist: I hear you. Can you tell me more about what's been causing your feelings of insecurity? [SEP] Client: It feels like I'm not good enough and I'm constantly comparing myself to others. [SEP] ,"Therapist: It can be tough to navigate feelings of self-doubt and comparison, but there are ways to cultivate self-confidence and self-acceptance. Have you considered exploring some self-compassion practices or working with a therapist to help you build your self-esteem?"
153,"Therapist: I hear you. Can you tell me more about what's been causing your feelings of insecurity? [SEP] Client: It feels like I'm not good enough and I'm constantly comparing myself to others. [SEP] Therapist: It can be tough to navigate feelings of self-doubt and comparison, but there are ways to cultivate self-confidence and self-acceptance. Have you considered exploring some self-compassion practices or working with a therapist to help you build your self-esteem? [SEP] ","Client: I've thought about it, but I'm not sure if it will help."
154,"Client: It feels like I'm not good enough and I'm constantly comparing myself to others. [SEP] Therapist: It can be tough to navigate feelings of self-doubt and comparison, but there are ways to cultivate self-confidence and self-acceptance. Have you considered exploring some self-compassion practices or working with a therapist to help you build your self-esteem? [SEP] Client: I've thought about it, but I'm not sure if it will help. [SEP] ",Therapist: We can work together to identify some strategies to help you build a more positive self-image and let go of any unnecessary self-judgment. It's important to prioritize your mental health and cultivate a sense of self-worth.
155,Client: I'm feeling really angry and resentful towards someone. [SEP] Therapist: I hear you. Can you tell me more about what's been causing your feelings of anger? [SEP] Client: It feels like someone has wronged me and I can't let go of the hurt and resentment. [SEP] ,"Therapist: It's understandable to feel angry and hurt when someone has wronged you, but holding onto those emotions can be harmful to your mental health. Have you considered exploring some forgiveness practices or working with a therapist to process your feelings?"
156,"Therapist: I hear you. Can you tell me more about what's been causing your feelings of anger? [SEP] Client: It feels like someone has wronged me and I can't let go of the hurt and resentment. [SEP] Therapist: It's understandable to feel angry and hurt when someone has wronged you, but holding onto those emotions can be harmful to your mental health. Have you considered exploring some forgiveness practices or working with a therapist to process your feelings? [SEP] ","Client: I've thought about it, but I'm not sure if I'm ready to forgive."
157,"Client: It feels like someone has wronged me and I can't let go of the hurt and resentment. [SEP] Therapist: It's understandable to feel angry and hurt when someone has wronged you, but holding onto those emotions can be harmful to your mental health. Have you considered exploring some forgiveness practices or working with a therapist to process your feelings? [SEP] Client: I've thought about it, but I'm not sure if I'm ready to forgive. [SEP] ",Therapist: We can work together to explore some strategies for managing your anger and finding ways to release any negative emotions you may be holding onto. It's important to prioritize your emotional well-being and find ways to heal from past hurts.
